{
 "step_id": "S04",
 "band": "L1",
 "packet_sha256": "sha256:712fcbd279758ca7a9ee52e931b85f8e4a5850b7ba26705042811806a0fc4daa",
 "author": {
  "host": "Claude Code desktop, in-session",
  "model": "claude-opus-5-5"
 },
 "attempt": 1,
 "beats": [
  {
   "id": "b01",
   "t": 0.0,
   "dur": 1.5,
   "event_type": "action",
   "actor": "ugc_creator",
   "label": "lift_glasses",
   "participants": [
    {
     "kind": "prop",
     "id": "glasses"
    },
    {
     "kind": "surface",
     "id": "tabletop"
    }
   ],
   "modes": {
    "ugc_creator": "casual"
   },
   "pos": {
    "ugc_creator": [
     0,
     0.97,
     0
    ]
   },
   "facing": {
    "ugc_creator": [
     0,
     0,
     1
    ]
   },
   "action": "Talking to camera, the creator picks the folded glasses up off the desk with the right hand.",
   "requires": [
    {
     "subject": {
      "kind": "prop",
      "id": "glasses"
     },
     "property": "holder",
     "value": "none"
    },
    {
     "subject": {
      "kind": "prop",
      "id": "glasses"
     },
     "property": "location",
     "value": "tabletop"
    },
    {
     "subject": {
      "kind": "prop",
      "id": "glasses"
     },
     "property": "temples",
     "value": "folded"
    },
    {
     "subject": {
      "kind": "prop",
      "id": "glasses"
     },
     "property": "worn",
     "value": "no"
    }
   ],
   "effects": [
    {
     "subject": {
      "kind": "prop",
      "id": "glasses"
     },
     "property": "holder",
     "value": "ugc_creator"
    }
   ],
   "contacts": [
    {
     "contact_type": "possess",
     "a": {
      "kind": "entity",
      "id": "ugc_creator",
      "part": "right_hand"
     },
     "b": {
      "kind": "prop",
      "id": "glasses",
      "part": "frame"
     },
     "at": "start"
    }
   ],
   "causes": [
    {
     "to": "b02",
     "causal_strength": "hard",
     "why": "Holding the frame lets the other hand open the temples."
    }
   ],
   "prop_samples": [
    {
     "prop": "glasses",
     "t": 0.0,
     "p": [
      -0.25,
      0.75,
      0.35
     ],
     "v": [
      0,
      0,
      0
     ],
     "float": false
    },
    {
     "prop": "glasses",
     "t": 1.5,
     "p": [
      0.2,
      1.1,
      0.3
     ],
     "v": null,
     "float": false
    }
   ]
  },
  {
   "id": "b02",
   "t": 1.5,
   "dur": 2.0,
   "event_type": "action",
   "actor": "ugc_creator",
   "label": "unfold_glasses",
   "participants": [
    {
     "kind": "prop",
     "id": "glasses"
    }
   ],
   "modes": {
    "ugc_creator": "demo"
   },
   "pos": {
    "ugc_creator": [
     0,
     0.97,
     0
    ]
   },
   "facing": {
    "ugc_creator": [
     0,
     0,
     1
    ]
   },
   "action": "Holding the frame steady in the right hand, the left hand swings the temples open, one then the other.",
   "requires": [
    {
     "subject": {
      "kind": "prop",
      "id": "glasses"
     },
     "property": "holder",
     "value": "ugc_creator"
    },
    {
     "subject": {
      "kind": "prop",
      "id": "glasses"
     },
     "property": "temples",
     "value": "folded"
    }
   ],
   "effects": [
    {
     "subject": {
      "kind": "prop",
      "id": "glasses"
     },
     "property": "temples",
     "value": "open"
    }
   ],
   "contacts": [
    {
     "contact_type": "touch",
     "a": {
      "kind": "entity",
      "id": "ugc_creator",
      "part": "left_hand"
     },
     "b": {
      "kind": "prop",
      "id": "glasses",
      "part": "left_temple"
     }
    }
   ],
   "causes": [
    {
     "to": "b03",
     "causal_strength": "hard",
     "why": "Open temples let the glasses go on."
    }
   ],
   "prop_samples": [
    {
     "prop": "glasses",
     "t": 3.5,
     "p": [
      0.0,
      1.25,
      0.25
     ],
     "v": null,
     "float": false
    }
   ]
  },
  {
   "id": "b03",
   "t": 3.5,
   "dur": 2.0,
   "event_type": "action",
   "actor": "ugc_creator",
   "label": "put_on_glasses",
   "participants": [
    {
     "kind": "prop",
     "id": "glasses"
    }
   ],
   "modes": {
    "ugc_creator": "demo"
   },
   "pos": {
    "ugc_creator": [
     0,
     0.97,
     0
    ]
   },
   "facing": {
    "ugc_creator": [
     0,
     0,
     1
    ]
   },
   "action": "Both hands lift the open glasses to the face and slide the temples over the ears; the right hand lets go.",
   "requires": [
    {
     "subject": {
      "kind": "prop",
      "id": "glasses"
     },
     "property": "temples",
     "value": "open"
    },
    {
     "subject": {
      "kind": "prop",
      "id": "glasses"
     },
     "property": "worn",
     "value": "no"
    }
   ],
   "effects": [
    {
     "subject": {
      "kind": "prop",
      "id": "glasses"
     },
     "property": "worn",
     "value": "yes"
    },
    {
     "subject": {
      "kind": "prop",
      "id": "glasses"
     },
     "property": "holder",
     "value": "none"
    }
   ],
   "contacts": [
    {
     "contact_type": "touch",
     "a": {
      "kind": "entity",
      "id": "ugc_creator",
      "part": "left_hand"
     },
     "b": {
      "kind": "prop",
      "id": "glasses",
      "part": "left_temple"
     }
    },
    {
     "contact_type": "touch",
     "a": {
      "kind": "entity",
      "id": "ugc_creator",
      "part": "head"
     },
     "b": {
      "kind": "prop",
      "id": "glasses",
      "part": "frame"
     }
    },
    {
     "contact_type": "release",
     "a": {
      "kind": "entity",
      "id": "ugc_creator",
      "part": "right_hand"
     },
     "b": {
      "kind": "prop",
      "id": "glasses",
      "part": "frame"
     }
    }
   ],
   "causes": [
    {
     "to": "b04",
     "causal_strength": "soft",
     "why": "Wearing them, the creator shows the result."
    }
   ],
   "prop_samples": [
    {
     "prop": "glasses",
     "t": 5.5,
     "p": [
      0,
      1.66,
      0.06
     ],
     "v": [
      0,
      0,
      0
     ],
     "float": false
    }
   ]
  },
  {
   "id": "b04",
   "t": 5.5,
   "dur": 2.5,
   "event_type": "hold",
   "actor": "ugc_creator",
   "label": "show_result",
   "participants": [
    {
     "kind": "prop",
     "id": "glasses"
    }
   ],
   "modes": {
    "ugc_creator": "casual"
   },
   "pos": {
    "ugc_creator": [
     0,
     0.97,
     0
    ]
   },
   "facing": {
    "ugc_creator": [
     0,
     0,
     1
    ]
   },
   "action": "Wearing the glasses, the creator smiles to camera and taps the frame.",
   "requires": [
    {
     "subject": {
      "kind": "prop",
      "id": "glasses"
     },
     "property": "worn",
     "value": "yes"
    }
   ],
   "effects": [],
   "contacts": [],
   "causes": [],
   "prop_samples": [
    {
     "prop": "glasses",
     "t": 8.0,
     "p": [
      0,
      1.66,
      0.06
     ],
     "v": [
      0,
      0,
      0
     ],
     "float": false
    }
   ]
  }
 ]
}
